{
  "agent_id": "agent.hr-self-service-001",
  "agent_name": "hr-self-service-agent",
  "agent_type": "single_agent",
  "business_owner": "hr-operations",
  "technical_owner": "platform-automation",
  "review_owner": "governance-review",
  "intended_users": [
    "hr-operators"
  ],
  "operating_context": "Handles low-risk HR self-service triage in a bounded preview environment."
}
